Symbol,Name,Last Sale,Net Change,% Change,Market Cap,Country,IPO Year,Volume,Sector,Industry
CS,Credit Suisse Group American Depositary Shares,$7.99,0.14,1.783%,20531779227.00,Switzerland,,8200517,Finance,Investment Bankers/Brokers/Service
CSAN,Cosan S.A. ADS,$20.33,0.53,2.677%,9497312788.00,,2021,154913,Consumer Durables,Automotive Aftermarket
CSL,Carlisle Companies Incorporated Common Stock,$250.19,4.27,1.736%,13026864398.00,United States,,622667,,
CSR,D/B/A Centerspace Common Stock,$101.50,3.38,3.445%,1526710931.00,United States,,153863,Consumer Services,Real Estate Investment Trusts
CSR^C,D/B/A Centerspace 6.625% Series C ,$25.41,0.22,0.873%,,United States,,4837,,
CSTA,Constellation Acquisition Corp I Class A Ordinary Shares,$9.81,0.00,0.00%,380137500.00,,2021,6868,Finance,Business Services
CSTM,Constellium SE Ordinary Shares (France),$18.33,0.33,1.833%,2596946119.00,Netherlands,2013,518417,Basic Industries,Aluminum
CSV,Carriage Services Inc. Common Stock,$52.49,-0.84,-1.575%,804500478.00,United States,,134184,Miscellaneous,Other Consumer Services
CTA^A,E.I. du Pont de Nemours and Company Preferred Stock,$77.24,-2.76,-3.45%,,United States,,6420,,
CTA^B,E.I. du Pont de Nemours and Company Preferred Stock,$95.05,-3.25,-3.306%,,United States,,7230,,
CTBB,Qwest Corporation 6.5% Notes due 2056,$24.52,-0.11,-0.447%,0.00,United States,2016,43566,,
CTDD,Qwest Corporation 6.75% Notes due 2057,$24.74,-0.21,-0.842%,0.00,United States,2017,45319,,
CTK,CooTek (Cayman) Inc. American Depositary Shares each representing 50 Class A Ordinary Shares,$0.2515,-0.0025,-0.984%,16901677.00,,2018,1285717,Technology,EDP Services
CTLT,Catalent Inc. Common Stock,$114.05,3.15,2.84%,20429561402.00,United States,2014,1231687,Health Care,Biotechnology: Pharmaceutical Preparations
CTO,CTO Realty Growth Inc. Common Stock,$66.99,0.67,1.01%,399835844.00,United States,,34347,Consumer Services,Real Estate Investment Trusts
CTO^A,CTO Realty Growth Inc. 6.375% Series A Cumulative Redeemable Preferred Stock,$25.33,0.18,0.716%,,United States,,1851,,
CTOS,Custom Truck One Source Inc. Common Stock,$8.34,-0.05,-0.596%,2060316319.00,Cayman Islands,2017,380536,Technology,Diversified Commercial Services
CTR,ClearBridge MLP and Midstream Total Return Fund Inc. Common Stock,$29.69,0.50,1.713%,209896424.00,United States,2012,30108,Finance,Investment Managers
CTRA,Coterra Energy Inc. Common Stock,$27.10,0.13,0.482%,21977525317.00,United States,,8055865,Energy,Oil & Gas Production
CTS,CTS Corporation Common Stock,$36.37,1.03,2.915%,1169381588.00,United States,,123044,Capital Goods,Industrial Machinery/Components
CTT,CatchMark Timber Trust Inc. Class A Common Stock,$8.23,0.03,0.366%,403442328.00,United States,2013,173125,Consumer Services,Real Estate Investment Trusts
CTV,Innovid Corp. Common Stock,$6.18,0.14,2.318%,814022542.00,,2021,168315,Technology,Advertising
CTVA,Corteva Inc. Common Stock ,$58.29,0.81,1.409%,42363633435.00,,2019,2430919,Basic Industries,Major Chemicals
CUBB,Customers Bancorp Inc 5.375% Subordinated Notes Due 2034,$25.50,0.198,0.783%,0.00,United States,2019,7034,Finance,Major Banks
CUBE,CubeSmart Common Shares,$53.27,1.24,2.383%,11932627824.00,United States,,767193,Consumer Services,Real Estate Investment Trusts
CUBI,Customers Bancorp Inc Common Stock,$51.16,-0.98,-1.88%,1685576041.00,United States,,397299,Finance,Major Banks
CUBI^E,Customers Bancorp Inc Fixed-to-Floating Rate Non-Cumulative Perpetual Preferred Stock Series E,$25.55,0.25,0.988%,,United States,,2018,,
CUBI^F,Customers Bancorp Inc Fixed-to-Floating Rate Non-Cumulative Perpetual Preferred Stock Series F,$24.835,0.0349,0.141%,,United States,,3200,,
CUK,Carnival Plc ADS ADS,$18.25,-0.02,-0.109%,20786750000.00,United States,,2585500,,
CULP,Culp Inc. Common Stock,$7.93,-0.01,-0.126%,96889271.00,United States,,17992,Basic Industries,Textiles
CURO,CURO Group Holdings Corp. Common Stock,$13.05,0.00,0.00%,525159666.00,,2017,55337,Finance,Diversified Financial Services
CURV,Torrid Holdings Inc. Common Stock,$5.88,-0.18,-2.97%,634202835.00,,2021,415669,Consumer Services,Clothing/Shoe/Accessory Stores
CUZ,Cousins Properties Incorporated Common Stock,$40.83,0.54,1.34%,6074010969.00,United States,,765890,Consumer Services,Real Estate Investment Trusts
CVE,Cenovus Energy Inc Common Stock,$16.94,0.26,1.559%,33800110960.00,Canada,,6491223,,
CVEO,Civeo Corporation (Canada) Common Shares,$23.51,-0.095,-0.402%,331743051.00,,2014,16175,,
CVI,CVR Energy Inc. Common Stock,$25.78,0.24,0.94%,2591678842.00,United States,2007,612175,Energy,Integrated oil Companies
CVII,Churchill Capital Corp VII Class A Common Stock,$9.77,-0.02,-0.204%,1685325000.00,,2021,99398,,
CVNA,Carvana Co. Class A Common Stock,$119.46,0.17,0.143%,10763463190.00,United States,2017,2588476,Consumer Services,Other Specialty Stores
CVS,CVS Health Corporation Common Stock,$101.09,-0.12,-0.119%,132681678964.00,United States,,6344349,Health Care,Managed Health Care
CVX,Chevron Corporation Common Stock,$164.22,1.39,0.854%,319827210480.00,United States,,8795068,Energy,Integrated oil Companies
CW,Curtiss-Wright Corporation Common Stock,$153.50,3.34,2.224%,5899339170.00,United States,,232786,Capital Goods,Industrial Machinery/Components
CWAN,Clearwater Analytics Holdings Inc. Class A Common Stock,$21.04,0.04,0.19%,3753988465.00,,2021,298818,Technology,Computer Software: Prepackaged Software
CWEN,Clearway Energy Inc. Class C Common Stock,$36.46,-0.05,-0.137%,4246499153.00,United States,2015,581709,Public Utilities,Electric Utilities: Central
CWH,Camping World Holdings Inc. Class A Commom Stock,$27.81,-0.14,-0.501%,1229586501.00,United States,2016,1565523,Consumer Services,Other Specialty Stores
CWK,Cushman & Wakefield plc Ordinary Shares,$20.59,0.08,0.39%,4623437390.00,,2018,1195343,Finance,Real Estate
CWT,California Water Service Group Common Stock,$61.72,2.44,4.116%,3315195677.00,United States,,485735,Public Utilities,Water Supply
CX,Cemex S.A.B. de C.V. Sponsored ADR,$5.29,0.00,0.00%,7791625511.00,Mexico,,6813764,Capital Goods,Building Materials
CXAC,C5 Acquisition Corporation Class A Common Stock,$9.92,0.0099,0.10%,356500000.00,,2022,65822,,
CXE,MFS High Income Municipal Trust Common Stock,$4.34,-0.05,-1.139%,136821855.00,United States,1989,90229,Finance,Investment Managers
CXH,MFS Investment Grade Municipal Trust Common Stock,$8.52,-0.02,-0.234%,77619287.00,United States,1989,9847,Finance,Investment Managers
CXM,Sprinklr Inc. Class A Common Stock,$12.00,0.10,0.84%,3066022920.00,,2021,466409,Technology,Computer Software: Prepackaged Software
CXW,CoreCivic Inc. Common Stock,$11.49,0.32,2.865%,1382071950.00,United States,,1182467,Consumer Services,Real Estate Investment Trusts
CYD,China Yuchai International Limited Common Stock,$11.51,-0.14,-1.202%,470278918.00,Singapore,1994,16757,Capital Goods,Construction/Ag Equipment/Trucks
CYH,Community Health Systems Inc. Common Stock,$11.94,0.07,0.59%,1577469350.00,United States,2000,1097924,Health Care,Hospital/Nursing Management
CZOO,Cazoo Group Ltd Class A Ordinary Shares,$2.79,0.03,1.087%,2118870550.00,,,897286,Consumer Durables,Automotive Aftermarket
D,Dominion Energy Inc. Common Stock,$86.33,1.36,1.601%,69985477873.00,United States,,2736113,Public Utilities,Electric Utilities: Central
DAC,Danaos Corporation Common Stock,$104.34,1.76,1.716%,2161574009.00,Greece,2006,264570,Transportation,Marine Transportation
DAL,Delta Air Lines Inc. Common Stock,$39.31,-0.26,-0.657%,25155638866.00,United States,,8598377,Transportation,Air Freight/Delivery Services
DAN,Dana Incorporated Common Stock ,$17.17,-0.40,-2.277%,2486503203.00,United States,,1603068,Capital Goods,Auto Parts:O.E.M.
DAO,Youdao Inc. American Depositary Shares each representing one Class A Ordinary Share,$7.77,0.67,9.437%,963332028.00,,2019,286634,Consumer Services,Other Consumer Services
DAR,Darling Ingredients Inc. Common Stock,$83.20,2.82,3.508%,13443052397.00,United States,,1730125,Consumer Non-Durables,Farming/Seeds/Milling
DASH,DoorDash Inc. Class A Common Stock,$120.90,3.71,3.166%,42122941524.00,,2020,2626635,Capital Goods,Industrial Machinery/Components
DAVA,Endava plc American Depositary Shares (each representing one Class A Ordinary Share),$130.99,-2.04,-1.533%,7334666766.00,United States,2018,200896,Technology,EDP Services
DB,Deutsche Bank AG Common Stock,$13.10,0.45,3.557%,27065833797.00,Germany,,6755174,Finance,Commercial Banks
DBD,Diebold Nixdorf Incorporated Common Stock,$6.61,-0.12,-1.783%,521710339.00,United States,,823960,Technology,EDP Services
DBI,Designer Brands Inc. Class A Common Stock,$13.55,0.04,0.296%,994357943.00,United States,,1433798,Consumer Services,Clothing/Shoe/Accessory Stores
DBL,DoubleLine Opportunistic Credit Fund Common Shares of Beneficial Interest,$16.81,0.05,0.298%,262117809.00,United States,2012,90589,,
DBRG,DigitalBridge Group Inc.,$7.36,0.16,2.222%,4405488904.00,United States,2014,3508515,Consumer Services,Real Estate Investment Trusts
DBRG^H,DigitalBridge Group Inc. 7.125% Series H ,$24.70,0.03,0.122%,,United States,,13100,,
DBRG^I,DigitalBridge Group Inc. 7.15% Series I ,$24.70,-0.19,-0.763%,,United States,,9989,,
DBRG^J,DigitalBridge Group Inc. 7.125% Series J ,$24.70,-0.02,-0.081%,,United States,,17055,,
DCF,BNY Mellon Alcentra Global Credit Income 2024 Target Term Fund Inc. Common Stock,$8.48,-0.01,-0.118%,127029111.00,,2017,10544,Finance,Finance/Investors Services
DCI,Donaldson Company Inc. Common Stock,$52.89,0.96,1.849%,6534981033.00,United States,,581994,Capital Goods,Pollution Control Equipment
DCO,Ducommun Incorporated Common Stock,$53.31,0.92,1.756%,638246938.00,United States,,27755,Capital Goods,Military/Government/Technical
DCP,DCP Midstream  LP Common Units ,$33.16,-0.40,-1.192%,6909838985.00,United States,,350848,Public Utilities,Natural Gas Distribution
DCP^B,DCP Midstream LP 7.875% Series B Fixed-to-Floating Rate Cumulative Redeemable Perpetual Preferred Units,$24.47,0.48,2.001%,,United States,,2098,,
DCP^C,DCP Midstream LP 7.95% Series C Fixed-to-Floating Rate Cumulative Redeemable Perpetual Preferred Units,$24.6472,-0.0528,-0.214%,,United States,,5185,,
DCUE,Dominion Energy Inc. 2019 Series A Corporate Units,$102.16,0.61,0.601%,0.00,United States,2019,11867,Public Utilities,Electric Utilities: Central
DD,DuPont de Nemours Inc. Common Stock,$74.75,1.17,1.59%,38339834429.00,,2017,2747964,Capital Goods,Wholesale Distributors
DDD,3D Systems Corporation Common Stock,$16.82,0.14,0.839%,2158173191.00,United States,,1504541,Technology,Computer peripheral equipment
DDF,Delaware Investments Dividend & Income Fund Inc. Common Stock,$10.83,-0.0029,-0.027%,82428841.00,United States,1993,12521,Finance,Finance/Investors Services
DDL,Dingdong (Cayman) Limited American Depositary Shares (each two representing three Ordinary Shares),$3.65,0.10,2.817%,861587365.00,,2021,1125470,,
DDS,Dillard's Inc. Common Stock,$271.70,3.31,1.233%,4988978223.00,United States,,142388,Consumer Services,Department/Specialty Retail Stores
DDT,Dillard's Capital Trust I,$26.54,0.47,1.803%,0.00,United States,,15699,Consumer Services,Department/Specialty Retail Stores
DE,Deere & Company Common Stock,$416.80,1.34,0.323%,127867707494.00,United States,,1480924,Capital Goods,Industrial Machinery/Components
DEA,Easterly Government Properties Inc. Common Stock,$21.33,0.19,0.899%,1923003334.00,United States,2015,748285,Consumer Services,Real Estate Investment Trusts
DECK,Deckers Outdoor Corporation Common Stock,$276.67,2.90,1.059%,7536845768.00,United States,1993,295173,Consumer Non-Durables,Shoe Manufacturing
DEI,Douglas Emmett Inc. Common Stock,$33.76,0.34,1.017%,5932342479.00,United States,2006,1395248,Consumer Services,Real Estate Investment Trusts
DELL,Dell Technologies Inc. Class C Common Stock ,$48.80,-1.39,-2.769%,37107439431.00,,2018,8084354,Technology,Computer Manufacturing
DEN,Denbury Inc. Common Stock,$80.93,2.36,3.004%,4062659779.00,,2020,397499,Energy,Oil & Gas Production
DEO,Diageo plc Common Stock,$205.13,1.99,0.98%,118499863121.00,United Kingdom,,314250,Consumer Non-Durables,Beverages (Production/Distribution)
DESP,Despegar.com Corp. Ordinary Shares,$12.04,-0.16,-1.311%,843995909.00,,2017,224396,Transportation,Other Consumer Services
DEX,Delaware Enhanced Global Dividend Common Shares of Beneficial Interest,$9.06,0.03,0.332%,101625141.00,United States,2007,38391,Finance,Finance Companies
DFIN,Donnelley Financial Solutions Inc. Common Stock ,$33.57,0.31,0.932%,1097455367.00,,2016,198097,Finance,Investment Managers
DFP,Flaherty & Crumrine Dynamic Preferred and Income Fund Inc. Common Stock,$26.05,0.01,0.038%,524552178.00,,2013,62761,Finance,Investment Managers
DFS,Discover Financial Services Common Stock,$110.12,-0.07,-0.064%,31056934152.00,United States,,1300178,Finance,Finance: Consumer Services
DG,Dollar General Corporation Common Stock,$226.30,3.67,1.648%,51792911678.00,United States,2009,1538796,Consumer Services,Department/Specialty Retail Stores
DGX,Quest Diagnostics Incorporated Common Stock,$136.33,-0.53,-0.387%,16285270294.00,United States,,1586213,Health Care,Medical Specialities
DHF,BNY Mellon High Yield Strategies Fund Common Stock,$2.81,0.03,1.079%,204368833.00,United States,1998,171609,Finance,Finance Companies
DHI,D.R. Horton Inc. Common Stock,$76.18,1.67,2.241%,26995005010.00,United States,,3625611,,
DHR,Danaher Corporation Common Stock,$291.69,-1.64,-0.559%,208819381923.00,United States,,3331432,Health Care,Medical Specialities
DHR^A,Danaher Corporation 4.75% Mandatory Convertible Preferred Stock Series A,$1942.43,-82.32,-4.066%,,United States,,7122,,
DHR^B,Danaher Corporation 5.00% Mandatory Convertible Preferred Stock Series B,$1570.86,-8.38,-0.531%,,United States,,94100,,
DHT,DHT Holdings Inc.,$5.86,0.06,1.034%,976503743.00,Jersey,2005,3805179,Transportation,Marine Transportation
DHX,DHI Group Inc. Common Stock,$6.10,0.15,2.521%,301490420.00,United States,2007,962803,Technology,Diversified Commercial Services
DIAX,Nuveen Dow 30SM Dynamic Overwrite Fund Common Shares of Beneficial Interest,$16.77,0.16,0.963%,609873148.00,,2014,121696,Finance,Finance Companies
DIDI,DiDi Global Inc. American Depositary Shares (each four representing one Class A Ordinary Share),$2.82,0.32,12.80%,13332073854.00,,2021,154543774,,
DIN,Dine Brands Global Inc. Common Stock,$75.59,-2.36,-3.028%,1290138826.00,United States,,212254,Consumer Services,Restaurants
DINO,HF Sinclair Corporation Common Stock,$39.89,0.04,0.10%,6502130234.00,United States,,1524027,Energy,Integrated oil Companies
DIS,Walt Disney Company (The) Common Stock,$137.00,-0.16,-0.117%,249426776896.00,United States,,10332416,Consumer Services,Movies/Entertainment
DK,Delek US Holdings Inc. Common Stock,$22.19,0.97,4.571%,1646423730.00,United States,2017,1144752,Energy,Integrated oil Companies
DKL,Delek Logistics Partners L.P. Common Units representing Limited Partner Interests,$44.39,0.40,0.909%,1929671165.00,United States,2012,38319,Energy,Oil & Gas Production
DKS,Dick's Sporting Goods Inc Common Stock,$101.32,1.30,1.30%,8090374745.00,United States,2002,1369459,Consumer Services,Other Specialty Stores
DLB,Dolby Laboratories Common Stock,$79.09,0.87,1.112%,8052812511.00,United States,2005,523041,Technology,EDP Services
DLNG,Dynagas LNG Partners LP Common Units,$3.80,-0.21,-5.237%,139848539.00,Greece,,234038,,
DLNG^A,Dynagas LNG Partners LP 9.00% Series A Cumulative Redeemable Preferred Units,$24.13,0.47,1.986%,,Greece,,11870,,
DLNG^B,Dynagas LNG Partners LP 8.75% Series B Fixed to Floating Rate Cumulative Redeemable Perpetual Preferred Units liquidation preference $25.00 per Uni,$23.08,0.4299,1.898%,,Greece,,13913,,
DLR,Digital Realty Trust Inc. Common Stock,$145.90,4.10,2.891%,41504042128.00,United States,2004,965230,Consumer Services,Real Estate Investment Trusts
DLR^J,Digital Realty Trust Inc. 5.250% Series J Cumulative Redeemable Preferred Stock,$24.90,-0.01,-0.04%,,United States,,23601,,
DLR^K,Digital Realty Trust Inc. 5.850% Series K Cumulative Redeemable Preferred Stock par value $0.01 per share,$26.058,0.028,0.108%,,United States,,7784,,
DLR^L,Digital Realty Trust Inc. 5.200% Series L Cumulative Redeemable Preferred Stock,$24.80,-0.10,-0.402%,,United States,,32549,,
DLX,Deluxe Corporation Common Stock,$30.37,0.13,0.43%,1301520836.00,United States,,416473,Technology,Advertising
DLY,DoubleLine Yield Opportunities Fund Common Shares of Beneficial Interest,$17.42,0.67,4.00%,835215470.00,,2020,352277,Finance,Investment Managers
DM,Desktop Metal Inc. Class A Common Stock,$4.74,0.00,0.00%,1481210800.00,,2019,4212074,Technology,Computer peripheral equipment
DMA,Destra Multi-Alternative Fund Common Stock,$8.98,0.08,0.899%,0.00,,2022,7258,Finance,Trusts Except Educational Religious and Charitable
DMB,BNY Mellon Municipal Bond Infrastructure Fund Inc. Common Stock,$12.45,0.04,0.322%,229019916.00,,2013,66913,Finance,Trusts Except Educational Religious and Charitable
DMO,Western Asset Mortgage Opportunity Fund Inc. Common Stock,$13.45,0.08,0.598%,154207626.00,United States,2010,18546,Finance,Trusts Except Educational Religious and Charitable
DMS,Digital Media Solutions Inc. Class A Ordinary Shares,$3.56,-0.08,-2.198%,129563833.00,United States,2018,30047,Technology,Advertising
DMYS,dMY Technology Group Inc. VI Class A Common Stock,$9.8761,0.0061,0.062%,298134769.00,,2021,1731,,
DNA,Ginkgo Bioworks Holdings Inc. Class A Common Stock,$4.20,0.17,4.218%,7390337959.00,United States,2021,23369908,Health Care,Biotechnology: Biological Products (No Diagnostic Substances)
DNB,Dun & Bradstreet Holdings Inc. Common Stock,$17.42,-0.10,-0.571%,7510909752.00,United States,2020,1878335,Technology,EDP Services
DNMR,Danimer Scientific Inc. Common Stock,$5.83,-0.03,-0.512%,587373753.00,,2020,1722857,Consumer Non-Durables,Plastic Products
DNOW,NOW Inc. Common Stock,$11.34,0.31,2.811%,1253737144.00,,2014,934454,Energy,Metal Fabrications
DNP,DNP Select Income Fund Inc. Common Stock,$11.87,0.05,0.423%,4097465445.00,United States,1987,449005,Finance,Investment Managers
DNZ,D and Z Media Acquisition Corp. Class A Common Stock,$9.78,-0.01,-0.102%,351468750.00,,2021,3197,,
DO,Diamond Offshore Drilling Inc. Common Stock,$6.89,-0.24,-3.366%,0.00,United States,2022,2011491,,
DOC,Physicians Realty Trust Common Shares of Beneficial Interest,$17.87,0.33,1.881%,4023346064.00,United States,2013,2469685,Consumer Services,Real Estate Investment Trusts
DOCN,DigitalOcean Holdings Inc. Common Stock,$59.57,1.72,2.973%,6410521422.00,United States,2021,1303266,Technology,Retail: Computer Software & Peripheral Equipment
DOCS,Doximity Inc. Class A Common Stock,$52.79,0.70,1.344%,10099466007.00,,2021,1437127,Technology,Retail: Computer Software & Peripheral Equipment
DOLE,Dole plc Ordinary Shares,$12.72,0.32,2.581%,1206844420.00,,2021,721145,,Farming/Seeds/Milling
DOMA,Doma Holdings Inc. Common Stock,$2.14,-0.03,-1.382%,693150755.00,,2021,1551938,Finance,Real Estate
DOOR,Masonite International Corporation Ordinary Shares (Canada),$85.34,-3.60,-4.048%,1925656990.00,Canada,,333321,,
DOUG,Douglas Elliman Inc. Common Stock,$7.37,0.07,0.959%,598518872.00,,2021,410811,Consumer Services,Building operators
DOV,Dover Corporation Common Stock,$158.55,1.65,1.052%,22848029607.00,United States,,636967,Capital Goods,Industrial Machinery/Components
DOW,Dow Inc. Common Stock ,$64.18,0.46,0.722%,47177810046.00,,2019,3317107,Basic Industries,Industrial Specialties
DPG,Duff & Phelps Utility and Infrastructure Fund Inc.,$15.30,0.12,0.791%,581283307.00,United States,2011,63712,Finance,Trusts Except Educational Religious and Charitable
DPZ,Domino's Pizza Inc Common Stock,$397.18,-9.83,-2.415%,14311710860.00,United States,2004,628477,Consumer Non-Durables,Food Distributors
DQ,DAQO New Energy Corp. American Depositary Shares each representing five ordinary shares,$43.19,1.87,4.526%,3217954307.00,China,2010,1466547,Technology,Semiconductors
DRD,DRDGOLD Limited American Depositary Shares,$9.75,0.38,4.055%,836527029.00,South Africa,,248702,Basic Industries,Precious Metals
DRE,Duke Realty Corporation Common Stock,$59.23,1.17,2.015%,22671331582.00,United States,,1241552,Consumer Services,Real Estate Investment Trusts
DRH,Diamondrock Hospitality Company Common Stock,$10.20,0.10,0.99%,2167188400.00,United States,2005,2779268,Consumer Services,Real Estate Investment Trusts
DRH^A,Diamondrock Hospitality Company 8.250% Series A Cumulative Redeemable Preferred Stock,$26.57,-0.38,-1.41%,,United States,,14661,,
DRI,Darden Restaurants Inc. Common Stock,$130.07,-2.88,-2.166%,16613018667.00,United States,,1711302,Consumer Services,Restaurants
DRQ,Dril-Quip Inc. Common Stock,$37.58,0.23,0.616%,1307501661.00,United States,1997,412962,Energy,Metal Fabrications
DS,Drive Shack Inc.,$1.51,-0.03,-1.948%,139061072.00,United States,,1412290,Consumer Services,Movies/Entertainment
DS^B,Drive Shack Inc. Preferred Series B,$24.295,0.085,0.351%,,United States,,1391,,
DS^C,Drive Shack Inc. Preferred Series C,$23.29,0.00,0.00%,,United States,,78,,
DS^D,Drive Shack Inc. Pfd Ser D,$23.4339,-0.2661,-1.123%,,United States,,1915,,
DSAQ,Direct Selling Acquisition Corp. Class A Common Stock,$10.00,0.00,0.00%,287500000.00,,2021,1,,
DSL,DoubleLine Income Solutions Fund Common Shares of Beneficial Interests,$14.63,0.11,0.758%,1492213594.00,,2013,512791,Finance,Trusts Except Educational Religious and Charitable
DSM,BNY Mellon Strategic Municipal Bond Fund Inc. Common Stock,$7.05,-0.02,-0.283%,348421653.00,United States,1989,178298,Finance,Investment Managers
DSU,Blackrock Debt Strategies Fund Inc. Common Stock,$10.35,-0.07,-0.672%,482378217.00,United States,1998,464354,Finance,Finance Companies
DSX,Diana Shipping inc. common stock,$5.24,-0.16,-2.963%,443670800.00,Greece,2005,917190,Transportation,Marine Transportation
DSX^B,Diana Shipping Inc. Perpetual Preferred Shares Series B (Marshall Islands),$26.60,0.101,0.381%,,Greece,,851,,
DT,Dynatrace Inc. Common Stock,$47.85,0.75,1.592%,13672879684.00,United States,2019,1495823,Technology,EDP Services
DTB,DTE Energy Company 2020 Series G 4.375% Junior Subordinated Debentures due 2080,$22.15,-0.111,-0.499%,0.00,United States,2020,5017,Public Utilities,Electric Utilities: Central
DTC,Solo Brands Inc. Class A Common Stock,$8.21,-0.32,-3.751%,520494583.00,,2021,424288,Miscellaneous,Diversified Commercial Services
DTE,DTE Energy Company Common Stock,$134.94,2.73,2.065%,26143527938.00,United States,,901234,Public Utilities,Electric Utilities: Central
DTF,DTF Tax-Free Income 2028 Term Fund Inc. Common Stock,$12.99,0.00,0.00%,91314075.00,United States,1991,61312,Finance,Investment Managers
DTG,DTE Energy Company 2021 Series E 4.375% Junior Subordinated Debentures,$23.14,-0.13,-0.559%,0.00,United States,2021,27792,Public Utilities,Electric Utilities: Central
DTLA^,Brookfield DTLA Inc. 7.625% Series A Cumulative Redeemable Preferred Stock,$11.88,0.18,1.538%,,,,3265,,
DTM,DT Midstream Inc. Common Stock ,$54.84,0.58,1.069%,5304893876.00,,2021,709531,Public Utilities,Oil & Gas Production
DTP,DTE Energy Company 6.25% Corporate Units,$53.90,0.61,1.145%,0.00,United States,,12231,Public Utilities,Electric Utilities: Central
DTW,DTE Energy Company 2017 Series E 5.25% Junior Subordinated Debentures due 2077,$24.81,0.07,0.283%,0.00,United States,2017,173802,Public Utilities,Electric Utilities: Central
DUK,Duke Energy Corporation (Holding Company) Common Stock,$112.82,1.16,1.039%,86860057867.00,United States,,2302523,Public Utilities,Power Generation
DUK^A,Duke Energy Corporation Depositary Shares each representing a 1/1000th interest in a share of 5.75% Series A Cumulative Redeemable Perpetual Preferred Stock,$25.89,-0.03,-0.116%,,United States,,47488,,
DUKB,Duke Energy Corporation 5.625% Junior Subordinated Debentures due 2078,$25.71,0.00,0.00%,0.00,United States,2018,27958,Public Utilities,Power Generation
DV,DoubleVerify Holdings Inc. Common Stock,$25.89,0.72,2.861%,4211065691.00,,2021,622938,Technology,Computer Software: Prepackaged Software
DVA,DaVita Inc. Common Stock,$114.15,1.04,0.919%,10941493586.00,United States,,567394,Health Care,Medical/Nursing Services
DVN,Devon Energy Corporation Common Stock,$60.35,1.22,2.063%,40084470000.00,United States,,6286827,Energy,Oil & Gas Production
DWIN,Delwinds Insurance Acquisition Corp. Class A Common Stock,$9.9301,0.0001,0.001%,256084866.00,,2021,7516,,
DX,Dynex Capital Inc. Common Stock,$16.25,0.05,0.309%,595819331.00,United States,,482899,Consumer Services,Real Estate Investment Trusts
DX^C,Dynex Capital Inc. 6.900% Series C Fixed-to-Floating Rate Cumulative Redeemable Preferred Stock,$24.81,-0.10,-0.401%,,United States,,5952,,
DXC,DXC Technology Company Common Stock ,$31.35,-1.28,-3.923%,7664381256.00,,,1820884,Technology,EDP Services
DY,Dycom Industries Inc. Common Stock,$96.37,1.11,1.165%,2853850778.00,United States,,236401,Basic Industries,Water Sewer Pipeline Comm & Power Line Construction
DYFN,Angel Oak Dynamic Financial Strategies Income Term Trust Common Shares of Beneficial Interest,$18.69,0.18,0.972%,75787950.00,,2020,2657,Finance,Finance/Investors Services
E,ENI S.p.A. Common Stock,$29.68,0.43,1.47%,52529989042.00,Italy,,317489,Energy,Oil & Gas Production
EAF,GrafTech International Ltd. Common Stock,$9.73,0.11,1.143%,2561478039.00,United States,2018,1880374,Consumer Durables,Metal Fabrications
EAI,Entergy Arkansas LLC First Mortgage Bonds 4.875% Series Due September 1 2066,$24.97,-0.03,-0.12%,0.00,United States,2016,11230,,
EARN,Ellington Residential Mortgage REIT Common Shares of Beneficial Interest,$9.71,-0.38,-3.766%,127297381.00,United States,2013,235649,Consumer Services,Real Estate Investment Trusts
EAT,Brinker International Inc. Common Stock,$36.96,-1.20,-3.145%,1648385101.00,United States,,984481,Consumer Services,Restaurants
EB,Eventbrite Inc. Class A Common Stock,$14.93,0.16,1.083%,1456523382.00,United States,2018,567359,Technology,EDP Services
