Symbol,Name,Last Sale,Net Change,% Change,Market Cap,Country,IPO Year,Volume,Sector,Industry
RACE,Ferrari N.V. Common Shares,$221.08,2.99,1.371%,40524019491.00,,2015,264555,Capital Goods,Auto Manufacturing
RAD,Rite Aid Corporation Common Stock,$8.32,-0.43,-4.914%,464107688.00,United States,,4609932,Health Care,Medical/Nursing Services
RAMP,LiveRamp Holdings Inc. Common Stock,$38.54,1.15,3.076%,2627536261.00,United States,2018,428177,Technology,EDP Services
RBA,Ritchie Bros. Auctioneers Incorporated Common Stock,$59.22,0.19,0.322%,6551771418.00,Canada,,193160,,
RBAC,RedBall Acquisition Corp. Class A Ordinary Shares,$9.92,-0.01,-0.101%,713000000.00,United States,2020,24967,Finance,Business Services
RBLX,Roblox Corporation Class A Common Stock,$46.02,-0.22,-0.476%,27048686345.00,,2021,15768778,Technology,EDP Services
RBOT,Vicarious Surgical Inc. Class A Common Stock,$4.99,-0.07,-1.383%,597647644.00,Hong Kong,2020,237028,Health Care,Medical Specialities
RC,Ready Capital Corproation Common Stock,$15.23,0.17,1.129%,1729904134.00,United States,2013,923212,Consumer Services,Real Estate Investment Trusts
RC^C,Ready Capital Corporation 6.25% Series C Cumulative Convertible Preferred Stock,$23.00,0.35,1.545%,,United States,,1173,,
RC^E,Ready Capital Corporation 6.50% Series E Cumulative Redeemable Preferred Stock,$22.90,0.00,0.00%,,United States,,5555,,
RCA,Ready Capital Corporation 7.00% Convertible Senior Notes due 2023,$26.42,0.17,0.648%,0.00,United States,2017,9524,Consumer Services,Real Estate Investment Trusts
RCB,Ready Capital Corporation 6.20% Senior Notes due 2026,$25.40,0.03,0.118%,0.00,United States,2019,2970,,
RCC,Ready Capital Corporation 5.75% Senior Notes due 2026,$25.00,0.05,0.20%,0.00,United States,2021,6492,Finance,Finance Companies
RCFA,RCF Acquisition Corp. Class A Ordinary Shares,$9.93,-0.01,-0.101%,285487500.00,,2021,151629,,
RCI,Rogers Communication Inc. Common Stock,$57.13,0.38,0.67%,28846383417.00,Canada,,208828,,
RCL,D/B/A Royal Caribbean Cruises Ltd. Common Stock,$83.66,-0.12,-0.143%,21333531822.00,United States,1993,2556157,,
RCS,PIMCO Strategic Income Fund Inc.,$5.92,0.04,0.68%,264085280.00,United States,1994,112141,Finance,Investment Managers
RCUS,Arcus Biosciences Inc. Common Stock,$31.99,0.43,1.362%,2273269125.00,,2018,731273,Health Care,Biotechnology: Pharmaceutical Preparations
RDN,Radian Group Inc. Common Stock,$22.06,-0.15,-0.675%,3872094537.00,United States,,1191018,Finance,Property-Casualty Insurers
RDW,Redwire Corporation Common Stock,$6.05,-2.43,-28.656%,360950702.00,United States,2021,3252185,Capital Goods,Aerospace
RDY,Dr. Reddy's Laboratories Ltd Common Stock,$55.82,0.09,0.161%,9263567798.00,India,,937847,Health Care,Biotechnology: Pharmaceutical Preparations
RE,Everest Re Group Ltd. Common Stock,$307.10,5.72,1.898%,12060389434.00,Bermuda,,258414,Finance,Property-Casualty Insurers
RELX,RELX PLC PLC American Depositary Shares (Each representing One Ordinary Share),$31.14,0.04,0.129%,60131408228.00,United Kingdom,2015,517797,Consumer Services,Publishing
RENN,Renren Inc. American Depositary Shares each representing fifteen Class A ordinary shares,$22.47,0.59,2.697%,539714929.00,China,2011,65623,Technology,EDP Services
RERE,ATRenew Inc. American Depositary Shares (every three of which representing two Class A ordinary shares),$3.92,0.38,10.734%,872728557.00,,2021,501565,,
RES,RPC Inc. Common Stock,$11.05,0.38,3.561%,2392256424.00,United States,,1127846,Energy,Oilfield Services/Equipment
REV,Revlon Inc. New Common Stock,$8.14,0.07,0.867%,436846230.00,United States,1996,49525,Consumer Non-Durables,Package Goods/Cosmetics
REVG,REV Group Inc. Common Stock,$13.33,-0.07,-0.522%,839015447.00,United States,2017,435926,Capital Goods,Industrial Machinery/Components
REX,REX American Resources Corporation,$102.43,2.83,2.841%,606385600.00,United States,,26254,Basic Industries,Major Chemicals
REXR,Rexford Industrial Realty Inc. Common Stock,$77.30,2.71,3.633%,12409451043.00,United States,2013,1111524,Consumer Services,Real Estate Investment Trusts
REXR^B,Rexford Industrial Realty Inc. 5.875% Series B Cumulative Redeemable Preferred Stock,$25.1201,-0.0299,-0.119%,,United States,,253,,
REXR^C,Rexford Industrial Realty Inc. 5.625% Series C Cumulative Redeemable Preferred Stock par value $0.01 per share,$25.10,0.06,0.24%,,United States,,3400,,
REZI,Resideo Technologies Inc. Common Stock ,$24.46,0.63,2.644%,3547156742.00,,2018,637801,Miscellaneous,Diversified Manufacture
RF,Regions Financial Corporation Common Stock,$21.47,-0.79,-3.549%,20120527497.00,United States,,11893581,Finance,Major Banks
RF^B,Regions Financial Corporation Depositary Shares Representing 1/40th Perpetual Preferred Series B,$26.33,0.08,0.305%,,United States,,42328,,
RF^C,Regions Financial Corporation Depositary Shares each Representing a 1/40th Interest in a  Share of 5.700% Fixed-to-Floating Rate Non-Cumulative  Perpetual Preferred Stock Series C,$25.948,-0.122,-0.468%,,United States,,9726,,
RF^E,Regions Financial Corporation Depositary Shares Each Representing a 1/40th Interest in a Share of 4.45% Non-Cumulative Perpetual Preferred Stock Series E,$21.32,-0.09,-0.42%,,United States,,18931,,
RFI,Cohen & Steers Total Return Realty Fund Inc. Common Stock,$15.64,0.17,1.099%,411659846.00,United States,1993,59444,Finance,Investment Managers
RFL,Rafael Holdings Inc. Class B Common Stock,$2.82,0.31,12.351%,58666084.00,United States,2018,339320,Health Care,Biotechnology: Pharmaceutical Preparations
RFM,RiverNorth Flexible Municipal Income Fund Inc. Common Stock,$18.74,0.16,0.861%,114589459.00,,2020,27422,Finance,Trusts Except Educational Religious and Charitable
RFMZ,RiverNorth Flexible Municipal Income Fund II Inc. Common Stock,$16.40,0.00,0.00%,399368798.00,,2021,153012,Finance,Trusts Except Educational Religious and Charitable
RFP,Resolute Forest Products Inc. Common Stock,$12.57,-0.34,-2.634%,965580175.00,Canada,,1030085,Basic Industries,Paper
RGA,Reinsurance Group of America Incorporated Common Stock,$111.56,2.10,1.919%,7495707587.00,United States,,374798,Finance,Life Insurance
RGR,Sturm Ruger & Company Inc. Common Stock,$70.45,0.83,1.192%,1239680470.00,United States,,186215,,
RGS,Regis Corporation Common Stock,$2.02,-0.10,-4.717%,91890996.00,United States,1991,582930,,
RGT,Royce Global Value Trust Inc. Common Stock,$11.41,0.05,0.44%,71505808.00,,2013,12361,Finance,Trusts Except Educational Religious and Charitable
RH,RH Common Stock,$320.54,-5.55,-1.702%,6958529456.00,United States,2012,1676334,Consumer Services,Other Specialty Stores
RHI,Robert Half International Inc. Common Stock,$113.63,-0.55,-0.482%,12577248816.00,United States,,661056,Technology,Diversified Commercial Services
RHP,Ryman Hospitality Properties Inc. (REIT),$94.35,1.58,1.703%,5196089809.00,United States,,301392,Consumer Services,Real Estate Investment Trusts
RIG,Transocean Ltd (Switzerland) Common Stock,$4.64,0.07,1.532%,3160096453.00,Switzerland,,16662793,Energy,Oil & Gas Production
RIO,Rio Tinto Plc Common Stock,$82.68,2.28,2.836%,133976799770.00,Australia,2002,3345345,Basic Industries,Steel/Iron Ore
RIV,RiverNorth Opportunities Fund Inc. Common Stock,$16.04,0.07,0.438%,283384262.00,,2015,104633,Finance,Finance Companies
RJAC,Jackson Acquisition Company Class A Common Stock,$9.82,-0.06,-0.607%,199457860.00,,2022,119,,
RJF,Raymond James Financial Inc. Common Stock,$108.94,-0.97,-0.883%,22616166564.00,United States,,1392559,Finance,Investment Bankers/Brokers/Service
RKLY,Rockley Photonics Holdings Limited Ordinary Shares,$4.33,0.30,7.444%,556276144.00,,,514563,,
RKT,Rocket Companies Inc. Class A Common Stock,$11.04,-0.08,-0.719%,1336677174.00,United States,2020,3311213,Finance,Finance: Consumer Services
RKTA,Rocket Internet Growth Opportunities Corp. Class A Ordinary Shares,$9.78,-0.02,-0.204%,326407500.00,,2021,14430,,
RL,Ralph Lauren Corporation Common Stock,$112.00,-1.44,-1.269%,7970735472.00,United States,1997,706555,Consumer Non-Durables,Apparel
RLGY,Realogy Holdings Corp. Common Stock,$15.54,-0.14,-0.893%,1835556206.00,United States,2012,966302,Finance,Real Estate
RLI,RLI Corp. Common Stock (DE),$113.42,2.79,2.522%,5136798832.00,United States,,212930,Finance,Property-Casualty Insurers
RLJ,RLJ Lodging Trust Common Shares of Beneficial Interest $0.01 par value,$14.42,0.34,2.415%,2400617490.00,United States,2011,1769907,Consumer Services,Real Estate Investment Trusts
RLJ^A,RLJ Lodging Trust $1.95 Series A Cumulative Convertible  Preferred Shares,$27.56,0.01,0.036%,,United States,,2598,,
RLTY,Cohen & Steers Real Estate Opportunities and Income Fund Common Shares of Beneficial Interest,$19.91,0.02,0.101%,0.00,,2022,31147,Finance,Investment Managers
RLX,RLX Technology Inc. American Depositary Shares each representing the right to receive one (1) Class A ordinary share,$1.85,0.06,3.352%,2489831380.00,,2021,7534167,Consumer Non-Durables,Farming/Seeds/Milling
RM,Regional Management Corp. Common Stock,$48.51,-0.06,-0.124%,476704568.00,United States,2012,31395,Finance,Finance: Consumer Services
RMAX,RE/MAX Holdings Inc. Class A Common Stock,$27.27,-0.46,-1.659%,512844910.00,,2013,129960,Finance,Real Estate
RMD,ResMed Inc. Common Stock,$246.44,3.93,1.621%,36037967091.00,United States,,422760,Health Care,Medical/Dental Instruments
RMI,RiverNorth Opportunistic Municipal Income Fund Inc. Common Stock,$18.86,0.31,1.671%,120199834.00,,2018,16708,Finance,Finance/Investors Services
RMM,RiverNorth Managed Duration Municipal Income Fund Inc. Common Stock,$17.24,0.05,0.291%,340311187.00,,2019,48654,Finance,Trusts Except Educational Religious and Charitable
RMMZ,RiverNorth Managed Duration Municipal Income Fund II Inc. Common Stock,$19.30,0.01,0.052%,0.00,,2022,7796,Finance,Investment Managers
RMO,Romeo Power Inc. Class A Common Stock,$1.43,-0.06,-4.027%,192295851.00,,2019,8955631,Capital Goods,Automotive Aftermarket
RMPL^,RiverNorth Specialty Finance Corporation 5.875% ,$25.6299,0.3499,1.384%,,,,638,,
RMT,Royce Micro-Cap Trust Inc. Common Stock,$10.61,0.09,0.856%,479571448.00,United States,,63787,Finance,Investment Managers
RNG,RingCentral Inc. Class A Common Stock,$121.17,3.96,3.379%,11443557133.00,,2013,732410,Technology,EDP Services
RNGR,Ranger Energy Services Inc. Class A Common Stock,$10.40,0.15,1.463%,191665178.00,United States,2017,142474,Energy,Oilfield Services/Equipment
RNP,Cohen & Steers REIT and Preferred and Income Fund Inc. Common Shares,$27.29,0.40,1.488%,1298874564.00,United States,2003,111042,Finance,Investment Managers
RNR,RenaissanceRe Holdings Ltd. Common Stock,$161.90,3.39,2.139%,7154830510.00,Bermuda,,400546,Finance,Property-Casualty Insurers
RNR^F,RenaissanceRe Holdings Ltd. Depositary Shares each Representing a 1/1000th Interest in a 5.750% Series F Preference Share,$25.35,-0.15,-0.588%,,Bermuda,,2240,,
RNR^G,RenaissanceRe Holdings Ltd. Depositary Shares each representing a 1/1000th interest in a share of 4.20% Series G Preference Shares,$21.05,-0.07,-0.331%,,Bermuda,,14730,,
ROG,Rogers Corporation Common Stock,$272.80,1.10,0.405%,5129515961.00,United States,,207969,Capital Goods,Industrial Machinery/Components
ROK,Rockwell Automation Inc. Common Stock,$284.48,4.45,1.589%,33055473356.00,United States,,740472,Capital Goods,Industrial Machinery/Components
ROL,Rollins Inc. Common Stock,$34.81,-0.24,-0.685%,17142540815.00,United States,,903467,Technology,Industrial Specialties
RONI,Rice Acquisition Corp. II Class A Ordinary Shares,$9.87,0.01,0.101%,340539675.00,,2021,96117,,
ROP,Roper Technologies Inc. Common Stock,$476.95,4.72,1.00%,50367272153.00,United States,1992,397856,Capital Goods,Office Equipment/Supplies/Services
ROSS,Ross Acquisition Corp II Class A Ordinary Shares,$9.81,-0.01,-0.102%,423056250.00,,2021,1126,,
RPM,RPM International Inc. Common Stock,$82.66,1.22,1.498%,10718996586.00,United States,,1223742,Basic Industries,Paints/Coatings
RPT,RPT Realty Common Stock,$14.01,0.24,1.743%,1189435424.00,United States,,561818,Consumer Services,Real Estate Investment Trusts
RPT^D,RPT Realty 7.25% ,$59.6801,0.3916,0.66%,,United States,,1443,,
RQI,Cohen & Steers Quality Income Realty Fund Inc Common Shares,$16.84,0.11,0.658%,2261618871.00,United States,2002,307689,Finance,Trusts Except Educational Religious and Charitable
RRAC,Rigel Resource Acquisition Corp. Class A Ordinary Shares,$9.94,0.015,0.151%,372750000.00,,2021,362188,,
RRC,Range Resources Corporation Common Stock,$31.55,1.17,3.851%,8270706016.00,United States,,3462437,Energy,Oil & Gas Production
RRX,Regal Rexnord Corporation Common Stock,$148.47,-0.31,-0.208%,9981279545.00,United States,,631509,Consumer Durables,Metal Fabrications
RS,Reliance Steel & Aluminum Co. Common Stock (DE),$184.77,1.42,0.774%,11401165039.00,United States,1994,385604,Basic Industries,Steel/Iron Ore
RSF,RiverNorth Specialty Finance Corporation,$19.05,-0.36,-1.855%,78348497.00,,2019,73271,Finance,Investment Managers
RSG,Republic Services Inc. Common Stock,$133.25,0.75,0.566%,42078503555.00,United States,1998,1054765,Public Utilities,Environmental Services
RSI,Rush Street Interactive Inc. Class A Common Stock,$7.27,0.00,0.00%,444670648.00,,2020,768442,Consumer Services,Services-Misc. Amusement & Recreation
RSKD,Riskified Ltd. Class A Ordinary Shares,$6.02,-0.02,-0.331%,989284395.00,,2021,296282,,
RTX,Raytheon Technologies Corporation Common Stock,$100.17,1.10,1.11%,149280183324.00,United States,,3608261,Capital Goods,Military/Government/Technical
RVI,Retail Value Inc. Common Stock ,$3.07,0.01,0.327%,64829651.00,United States,2018,118540,Consumer Services,Real Estate Investment Trusts
RVLV,Revolve Group Inc. Class A Common Stock,$54.29,0.60,1.118%,3977116178.00,,2019,653203,Consumer Services,Catalog/Specialty Distribution
RVT,Royce Value Trust Inc. Common Stock,$17.10,0.11,0.647%,1811724275.00,United States,1986,178900,Finance,Trusts Except Educational Religious and Charitable
RWT,Redwood Trust Inc. Common Stock,$10.54,0.01,0.095%,1266581734.00,United States,1995,1110255,Consumer Services,Real Estate Investment Trusts
RY,Royal Bank Of Canada Common Stock,$109.74,-0.53,-0.481%,155459895151.00,Canada,,639384,,
RYAM,Rayonier Advanced Materials Inc. Common Stock,$6.62,0.05,0.761%,421948248.00,United States,2014,302321,Basic Industries,Industrial Specialties
RYAN,Ryan Specialty Group Holdings Inc. Class A Common Stock,$39.74,0.95,2.449%,4367209338.00,,2021,296298,,
RYB,RYB Education Inc. American depositary shares each representing one Class A ordinary share,$0.9698,0.0396,4.257%,26753238.00,,2017,4266,Miscellaneous,Other Consumer Services
RYI,Ryerson Holding Corporation Common Stock,$34.75,-0.27,-0.771%,1334197130.00,United States,2014,319395,Capital Goods,Office Equipment/Supplies/Services
RYN,Rayonier Inc. REIT Common Stock,$41.82,0.70,1.702%,6079349312.00,United States,,573832,Consumer Services,Real Estate Investment Trusts
RZA,Reinsurance Group of America Incorporated 6.20% Fixed-to-Floating Rate Subordinated Debentures due 2042,$25.41,0.01,0.039%,0.00,United States,,8293,Finance,Life Insurance
RZB,Reinsurance Group of America Incorporated 5.75% Fixed-To-Floating Rate Subordinated Debentures due 2056,$27.52,0.12,0.438%,0.00,United States,2016,9544,Finance,Life Insurance
S,SentinelOne Inc. Class A Common Stock,$38.88,0.14,0.361%,10377503101.00,United States,2021,2395652,Technology,EDP Services
SA,Seabridge Gold Inc. Ordinary Shares (Canada),$18.98,0.48,2.595%,1511390420.00,Canada,,240246,,
SAFE,Safehold Inc. Common Stock,$56.26,0.81,1.461%,3484843305.00,United States,2017,182950,Consumer Services,Real Estate Investment Trusts
SAH,Sonic Automotive Inc. Common Stock,$41.84,-0.67,-1.576%,1701575479.00,United States,1997,487025,Consumer Services,Other Specialty Stores
SAIC,SCIENCE APPLICATIONS INTERNATIONAL CORPORATION Common Stock,$92.77,0.60,0.651%,5199749594.00,,,462993,Technology,EDP Services
SAIL,SailPoint Technologies Holdings Inc. Common Stock,$52.02,0.84,1.641%,4899852286.00,United States,2017,766714,Technology,Computer Software: Prepackaged Software
SAK,Saratoga Investment Corp 7.25% Notes due 2025,$25.5246,0.0346,0.136%,0.00,United States,2020,4075,Finance,Finance Companies
SAM,Boston Beer Company Inc. (The) Common Stock,$391.15,2.68,0.69%,4808723390.00,United States,,85187,Consumer Non-Durables,Beverages (Production/Distribution)
SAN,Banco Santander S.A. Sponsored ADR (Spain),$3.48,0.10,2.959%,58479149143.00,Spain,,5958875,Finance,Commercial Banks
SAND          ,Sandstorm Gold Ltd. Ordinary Shares (Canada),$8.49,0.41,5.074%,1628448918.00,Canada,,2033838,,
SAP,SAP  SE ADS,$110.63,-0.33,-0.297%,130496862384.00,Germany,,749828,Technology,Computer Software: Prepackaged Software
SAR,Saratoga Investment Corp New,$27.31,0.05,0.183%,330497591.00,United States,,22450,Finance,Investment Managers
SAVE,Spirit Airlines Inc. Common Stock,$22.02,0.15,0.686%,2391649848.00,United States,,3998001,Transportation,Air Freight/Delivery Services
SB,Safe Bulkers Inc Common Stock ($0.001 par value),$4.77,0.01,0.21%,580266221.00,Monaco,2008,1948781,Transportation,Marine Transportation
SB^C,Safe Bulkers Inc Cumulative Redeemable Perpetual Preferred Series C (Marshall Islands),$25.4617,0.0817,0.322%,,Monaco,,12148,,
SB^D,Safe Bulkers Inc Perpetual Preferred Series D (Marshall Islands),$25.40,-0.05,-0.196%,,Monaco,,4806,,
SBBA,Scorpio Tankers Inc. 7.00% Senior Notes due 2025,$24.67,-0.011,-0.045%,0.00,Monaco,2020,2395,Transportation,Marine Transportation
SBH,Sally Beauty Holdings Inc. (Name to be changed from Sally Holdings Inc.) Common Stock,$15.48,-0.15,-0.96%,1703968771.00,United States,,1274799,Miscellaneous,Diversified Commercial Services
SBI,Western Asset Intermediate Muni Fund Inc Common Stock,$8.58,-0.01,-0.116%,120826263.00,United States,1992,9517,Finance,Finance/Investors Services
SBII,Sandbridge X2 Corp. Class A Common Stock,$9.78,0.03,0.308%,291171392.00,,2021,60050,,
SBOW,SilverBow Resorces Inc. Common Stock,$33.92,1.92,6.00%,564129456.00,,,155762,Energy,Oil & Gas Production
SBR,Sabine Royalty Trust Common Stock,$58.65,0.90,1.558%,855078584.00,United States,,53456,Energy,Oil & Gas Production
SBS,Companhia de saneamento Basico Do Estado De Sao Paulo - Sabesp American Depositary Shares (Each repstg 250 Common Shares),$10.92,1.09,11.089%,7463927769.00,Brazil,2002,9513216,,
SBSW,D/B/A Sibanye-Stillwater Limited ADS,$16.60,0.37,2.28%,11654886012.00,,,2542492,Basic Industries,Precious Metals
SCCO,Southern Copper Corporation Common Stock,$78.17,2.27,2.991%,60432200550.00,United States,,976143,Basic Industries,Precious Metals
SCD,LMP Capital and Income Fund Inc. Common Stock,$14.74,0.12,0.821%,258943623.00,United States,2004,45328,Finance,Trusts Except Educational Religious and Charitable
SCE^G,SCE Trust II Trust Preferred Securities,$22.39,-0.06,-0.267%,,United States,,6636,,
SCE^H,SCE Trust III Fixed/Floating Rate Trust Preference Securities,$23.65,-0.18,-0.755%,,United States,,6878,,
SCE^J,Southern California Edison Company 5.375% Fixed-to-Floating Rate Trust Preference Securities,$23.09,-0.15,-0.645%,,United States,,5592,,
SCE^K,Southern California Edison Company 5.45% Fixed-to-Floating Rate Trust Preference Securities,$24.89,-0.10,-0.40%,,United States,,23538,,
SCE^L,SCE TRUST VI,$22.05,-0.07,-0.316%,,United States,,35988,,
SCHW,Charles Schwab Corporation (The) Common Stock,$83.54,-0.77,-0.913%,158217614824.00,United States,,10638885,Finance,Investment Bankers/Brokers/Service
SCHW^D,The Charles Schwab Corporation Depositary Shares each representing 1/40th interest in a share of 5.95% Non-Cumulative Perpetual Preferred Stock Series D,$25.38,0.07,0.277%,,United States,,113523,,
SCHW^J,The Charles Schwab Corporation Depositary Shares Each Representing a 1/40th Interest in a Share of 4.450% Non-Cumulative Perpetual Preferred Stock Series J,$22.88,0.00,0.00%,,United States,,42319,,
SCI,Service Corporation International Common Stock,$67.01,1.19,1.808%,10772562244.00,United States,,1168590,Miscellaneous,Other Consumer Services
SCL,Stepan Company Common Stock,$101.56,2.75,2.783%,2277287599.00,United States,,179456,Consumer Non-Durables,Package Goods/Cosmetics
SCM,Stellus Capital Investment Corporation Common Stock,$13.95,0.06,0.432%,272270450.00,United States,2012,48430,Finance,Finance/Investors Services
SCS,Steelcase Inc. Common Stock,$11.77,-0.18,-1.506%,1319372568.00,United States,1998,828888,Consumer Durables,Office Equipment/Supplies/Services
SCU,Sculptor Capital Management Inc. Class A Common Stock,$14.13,0.20,1.436%,374560216.00,United States,,189524,Finance,Investment Managers
SCUA,Sculptor Acquisition Corp I Class A Ordinary Shares,$9.92,0.04,0.405%,285200000.00,,2022,2200,,
SCX,L.S. Starrett Company (The) Common Stock,$7.53,-0.16,-2.081%,54606468.00,United States,,58686,Consumer Durables,Home Furnishings
SD,SandRidge Energy Inc. Common Stock,$16.77,0.75,4.682%,615400624.00,,2016,724388,Energy,Oil & Gas Production
SDHY,PGIM Short Duration High Yield Opportunities Fund Common Shares,$16.86,0.13,0.777%,415987724.00,,2020,55868,Finance,Finance/Investors Services
SE,Sea Limited American Depositary Shares each representing one Class A Ordinary Share,$121.10,1.31,1.094%,67542066956.00,United States,2017,5215585,Technology,Computer Software: Prepackaged Software
SEAL^A,Seapeak LLC 9.00% Series A Cumulative Redeemable Perpetual Preferred Units,$25.03,0.12,0.482%,,Bermuda,,6464,,
SEAL^B,Seapeak LLC 8.50% Series B Fixed-to-Floating Rate Cumulative Redeemable Perpetual Preferred Units,$25.2501,0.0501,0.199%,,Bermuda,,6691,,
SEAS,SeaWorld Entertainment Inc. Common Stock,$72.32,-2.12,-2.848%,5470960413.00,United States,2013,839439,Consumer Services,Movies/Entertainment
SEE,Sealed Air Corporation Common Stock,$67.60,0.64,0.956%,10015490467.00,United States,,939883,Basic Industries,Containers/Packaging
SEM,Select Medical Holdings Corporation Common Stock,$24.64,0.65,2.709%,3295533004.00,United States,2009,872251,Health Care,Hospital/Nursing Management
SEMR,SEMrush Holdings Inc. Class A Common Stock,$11.96,0.02,0.168%,1686157123.00,,2021,230147,Technology,EDP Services
SES,SES AI Corporation Class A Common Stock,$9.34,0.29,3.204%,3249115560.00,,2021,623696,Capital Goods,Auto Parts:O.E.M.
SF,Stifel Financial Corporation Common Stock,$67.27,-0.63,-0.928%,7158925602.00,United States,,766887,Finance,Investment Bankers/Brokers/Service
SF^B,Stifel Financial Corporation Depositary Shares Each Representing 1/1000th  Interest in a Share of 6.25% Non-Cumulative  Preferred Stock Series B,$25.79,-0.11,-0.425%,,United States,,3372,,
SF^C,Stifel Financial Corporation Depositary Shares Each Representing 1/1000th Interest in a Share of 6.125% Non Cumulative Preferred Stock Series C,$25.9973,-0.0327,-0.126%,,United States,,4317,,
SF^D,Stifel Financial Corporation Depositary Shares Each Representing 1/1000th Interest in a Share of 4.50% Non-Cumulative Preferred Stock Series D,$20.60,-0.18,-0.866%,,United States,,16136,,
SFB,Stifel Financial Corporation 5.20% Senior Notes due 2047,$24.75,-0.12,-0.483%,0.00,United States,2017,9068,Finance,Investment Bankers/Brokers/Service
SFBS,ServisFirst Bancshares Inc. Common Stock,$95.47,0.18,0.189%,5182148070.00,United States,,227995,Finance,Major Banks
SFE,Safeguard Scientifics Inc. New Common Stock,$5.32,0.10,1.916%,88470770.00,United States,,20235,Finance,Finance/Investors Services
SFL,SFL Corporation Ltd,$10.34,0.16,1.572%,1432621342.00,Bermuda,,761691,Transportation,Marine Transportation
SFUN,Fang Holdings Limited American Depositary Shares (Each representing Four Class A Ordinary Shares HK$1.00 par value),$3.38,-0.15,-4.249%,30540693.00,China,2010,1409,Technology,EDP Services
SG,Sweetgreen Inc. Class A Common Stock,$31.74,-0.25,-0.781%,3500314401.00,,2021,472599,Consumer Services,Restaurants
SGFY,Signify Health Inc. Class A Common Stock,$18.50,0.35,1.928%,3251365732.00,,2021,825709,Technology,Retail: Computer Software & Peripheral Equipment
SGHC,Super Group (SGHC) Limited Ordinary Shares,$10.61,-0.10,-0.934%,5132216659.00,,2022,198058,Finance,Business Services
SGU,Star Group L.P. Common Stock,$11.19,0.09,0.811%,421610565.00,United States,,37939,Public Utilities,Oil Refining/Marketing
SHAK,Shake Shack Inc. Class A Common Stock,$69.33,1.43,2.106%,2916360349.00,United States,2015,614029,Consumer Services,Restaurants
SHAP,Spree Acquisition Corp. 1 Limited Class A Ordinary Shares,$9.95,0.00,0.00%,258470802.00,,2022,11300,,
SHEL,Royal Dutch Shell PLC American Depositary Shares (each representing two (2) Ordinary Shares) ,$55.72,0.79,1.438%,211249932821.00,Netherlands,,2749681,Energy,Oil & Gas Production
SHG,Shinhan Financial Group Co Ltd American Depositary Shares,$33.76,0.33,0.987%,17312844252.00,South Korea,,134076,Finance,Major Banks
SHI,SINOPEC Shangai Petrochemical Company Ltd. Common Stock,$21.02,0.52,2.537%,2275165598.00,China,,16933,Basic Industries,Major Chemicals
SHLX,Shell Midstream Partners L.P. Common Units representing Limited Partner Interests,$14.23,0.01,0.07%,5596510112.00,United States,2014,807082,Energy,Oilfield Services/Equipment
SHO,Sunstone Hotel Investors Inc. Sunstone Hotel Investors Inc. Common Shares,$11.67,-0.11,-0.934%,2522281248.00,United States,2004,3584241,Consumer Services,Real Estate Investment Trusts
SHO^H,Sunstone Hotel Investors Inc. 6.125% Series H Cumulative Redeemable Preferred Stock,$24.035,-0.075,-0.311%,,United States,,6650,,
SHO^I,Sunstone Hotel Investors Inc. 5.70% Series I Cumulative Redeemable Preferred Stock,$22.76,-0.07,-0.307%,,United States,,3932,,
SHOP,Shopify Inc. Class A Subordinate Voting Shares,$693.00,17.04,2.521%,87284549583.00,Canada,2015,2938591,,
SHPW,Shapeways Holdings Inc. Common Stock,$2.26,-0.60,-20.979%,109150054.00,,2019,253213,Capital Goods,Industrial Machinery/Components
SHW,Sherwin-Williams Company (The) Common Stock,$255.21,5.59,2.239%,66494362694.00,United States,,1378265,Basic Industries,Paints/Coatings
