Symbol,Name,Last Sale,Net Change,% Change,Market Cap,Country,IPO Year,Volume,Sector,Industry
A,Agilent Technologies Inc. Common Stock,$133.97,1.64,1.239%,40206189117.00,United States,1999,1466876,Capital Goods,Electrical Products
AA,Alcoa Corporation Common Stock ,$90.62,0.59,0.655%,16712207549.00,,2016,5745536,Basic Industries,Metal Fabrications
AAC,Ares Acquisition Corporation Class A Ordinary Shares,$9.80,-0.01,-0.102%,1225000000.00,,2021,250450,Finance,Business Services
AAIC,Arlington Asset Investment Corp Class A (new),$3.49,0.02,0.576%,106056151.00,United States,,278975,Consumer Services,Real Estate Investment Trusts
AAIC^B,Arlington Asset Investment Corp 7.00% ,$23.95,0.00,0.00%,,United States,,1267,,
AAIC^C,Arlington Asset Investment Corp 8.250% Seies C Fixed-to-Floating Rate Cumulative Redeemable Preferred Stock   ,$24.6501,-0.2898,-1.162%,,United States,,1000,,
AAIN,Arlington Asset Investment Corp 6.000% Senior Notes Due 2026,$25.13,0.088,0.351%,0.00,United States,,961,,
AAM^A,Apollo Asset Management Inc. 6.375% Series A Preferred Stock,$25.17,0.01,0.04%,,United States,,2588,,
AAM^B,Apollo Asset Management Inc. 6.375% Series B Preferred Stock,$25.52,-0.07,-0.274%,,United States,,11108,,
AAN,Aarons Holdings Company Inc. Common Stock ,$20.15,0.07,0.349%,643489565.00,United States,2020,331967,Miscellaneous,Diversified Commercial Services
AAP,Advance Auto Parts Inc.,$207.48,0.52,0.251%,12676525691.00,United States,,693447,Consumer Services,Other Specialty Stores
AAQC,Accelerate Acquisition Corp. Class A Common Stock,$9.75,-0.01,-0.102%,487500000.00,,2021,1804,,
AAT,American Assets Trust Inc. Common Stock,$38.71,0.82,2.164%,2342877498.00,United States,2011,331384,Consumer Services,Real Estate Investment Trusts
AB,AllianceBernstein Holding L.P.  Units,$47.83,0.81,1.723%,4748166702.00,United States,,256940,Finance,Investment Managers
ABB,ABB Ltd Common Stock,$32.87,0.53,1.639%,62885183438.00,Switzerland,,2186614,Consumer Durables,Electrical Products
ABBV,AbbVie Inc. Common Stock,$162.68,0.57,0.352%,287339231436.00,United States,2012,5702471,Health Care,Other Pharmaceuticals
ABC,AmerisourceBergen Corporation Common Stock,$156.52,1.81,1.17%,32734190387.00,United States,,822838,Health Care,Other Pharmaceuticals
ABEV,Ambev S.A. American Depositary Shares (Each representing 1 Common Share),$3.29,0.06,1.858%,51780927630.00,,2013,22546555,Consumer Non-Durables,Beverages (Production/Distribution)
ABG,Asbury Automotive Group Inc Common Stock,$157.86,-2.34,-1.461%,3660524928.00,United States,2002,261923,Consumer Services,Other Specialty Stores
ABM,ABM Industries Incorporated Common Stock,$46.38,0.34,0.738%,3101386864.00,United States,,928873,Technology,Diversified Commercial Services
ABR,Arbor Realty Trust Common Stock,$17.30,0.24,1.407%,2755263498.00,United States,2004,1688272,Consumer Services,Real Estate Investment Trusts
ABR^D,Arbor Realty Trust 6.375% Series D Cumulative Redeemable Preferred Stock Liquidation Preference $25.00 per Share,$22.41,-0.09,-0.40%,,United States,,8573,,
ABR^E,Arbor Realty Trust 6.25% Series E Cumulative Redeemable Preferred Stock,$22.83,0.00,0.00%,,United States,,14302,,
ABR^F,Arbor Realty Trust 6.25% Series F Fixed-to-Floating Rate Cumulative Redeemable Preferred Stock Liquidation Preference $25.00 per share,$24.53,-0.16,-0.648%,,United States,,20073,,
ABT,Abbott Laboratories Common Stock,$118.58,0.22,0.186%,209113727221.00,United States,,4314081,Health Care,Medical/Dental Instruments
AC,Associated Capital Group Inc. Common Stock,$40.97,-0.94,-2.243%,903427462.00,United States,2015,11592,Finance,Investment Bankers/Brokers/Service
ACA,Arcosa Inc. Common Stock ,$58.00,0.75,1.31%,2802145880.00,,2018,323829,Capital Goods,Engineering & Construction
ACAQ,Athena Consumer Acquisition Corp. Class A Common Stock,$9.98,0.00,0.00%,320457800.00,,2021,246539,,
ACC,American Campus Communities Inc Common Stock,$57.44,1.47,2.626%,7993173083.00,United States,2004,573861,Consumer Services,Real Estate Investment Trusts
ACCO,Acco Brands Corporation Common Stock,$8.04,0.04,0.50%,770644364.00,United States,,1043290,Consumer Services,Advertising
ACDI,Ascendant Digital Acquisition Corp. III Class A Ordinary Shares,$10.01,0.01,0.10%,375375000.00,,2021,1300,,
ACEL,Accel Entertainment Inc. ,$12.53,0.35,2.874%,1162764879.00,United States,2017,268686,Consumer Services,Recreational Products/Toys
ACH,Aluminum Corporation of China Limited American Depositary Shares,$15.03,0.56,3.87%,10234030978.00,China,2001,66903,Basic Industries,Aluminum
ACHR,Archer Aviation Inc. Class A Common Stock,$4.75,-0.06,-1.247%,1116075637.00,United States,2020,1062181,Capital Goods,Aerospace
ACI,Albertsons Companies Inc. Class A Common Stock,$33.93,0.68,2.045%,16939214320.00,United States,2020,1726754,Consumer Services,Food Chains
ACII,Atlas Crest Investment Corp. II Class A Common Stock,$9.80,-0.02,-0.204%,422625000.00,,2021,26117,,
ACM,AECOM Common Stock,$77.60,0.79,1.029%,10968199495.00,United States,2007,785241,Consumer Services,Military/Government/Technical
ACN,Accenture plc Class A Ordinary Shares (Ireland),$340.64,3.41,1.011%,215761626711.00,Ireland,2001,2090283,Technology,EDP Services
ACP,Aberdeen Income Credit Strategies Fund Common Shares,$9.78,-0.01,-0.102%,228391264.00,United States,2011,137938,Finance,Investment Managers
ACP^A,Aberdeen Income Credit Strategies Fund 5.250% Series A Perpetual Preferred Stock,$24.93,-0.08,-0.32%,,United States,,3635,,
ACR,ACRES Commercial Realty Corp. Common Stock,$13.47,0.06,0.447%,119748906.00,United States,,10018,Consumer Services,Real Estate Investment Trusts
ACR^C,ACRES Commercial Realty Corp. 8.625% Fixed-to-Floating Series C Cumulative Redeemable Preferred Stock ,$24.8301,-0.0399,-0.16%,,United States,,11271,,
ACR^D,ACRES Commercial Realty Corp. 7.875% Series D Cumulative Redeemable Preferred Stock,$24.71,-0.02,-0.081%,,United States,,873,,
ACRE,Ares Commercial Real Estate Corporation Common Stock,$15.73,0.21,1.353%,742803114.00,United States,2012,425248,Consumer Services,Real Estate Investment Trusts
ACRO,Acropolis Infrastructure Acquisition Corp. Class A Common Stock,$9.695,-0.015,-0.154%,418096875.00,,2021,177200,,
ACV,Virtus AllianzGI Diversified Income & Convertible Fund Common Shares of Beneficial Interest,$25.55,0.10,0.393%,264542656.00,United States,2015,42184,Finance,Finance/Investors Services
ADC,Agree Realty Corporation Common Stock,$67.48,1.12,1.688%,4816898928.00,United States,,478629,Consumer Services,Real Estate Investment Trusts
ADC^A,Agree Realty Corporation Depositary Shares each representing 1/1000th of a 4.250% Series A Cumulative Redeemable Preferred Stock,$19.7001,-0.1799,-0.905%,,United States,,13611,,
ADCT,ADC Therapeutics SA Common Shares,$14.83,0.14,0.953%,1139099374.00,,2020,327680,Health Care,Biotechnology: Pharmaceutical Preparations
ADEX,Adit EdTech Acquisition Corp. Common Stock,$9.88,0.00,0.00%,340860000.00,,2021,14159,,
ADM,Archer-Daniels-Midland Company Common Stock,$91.17,0.91,1.008%,51281071669.00,United States,,2761725,,
ADNT,Adient plc Ordinary Shares ,$39.28,-1.49,-3.655%,3722423367.00,,2016,1052223,Capital Goods,Auto Parts:O.E.M.
ADS,Alliance Data Systems Corporation Common Stock,$56.80,0.65,1.158%,2837054693.00,United States,2001,463839,Finance,Diversified Financial Services
ADT,ADT Inc. Common Stock,$7.74,0.15,1.976%,7051608107.00,United States,2018,1463325,Consumer Services,Diversified Commercial Services
ADX,Adams Diversified Equity Fund Inc.,$18.51,0.07,0.38%,2181020454.00,United States,,141300,Finance,Investment Managers
AEE,Ameren Corporation Common Stock,$94.79,1.03,1.099%,24464495655.00,United States,,1246286,Public Utilities,Power Generation
AEFC,Aegon Funding Company LLC 5.10% Subordinated Notes due 2049,$24.04,-0.25,-1.029%,0.00,,2019,37325,,
AEG,AEGON N.V. Common Stock,$5.49,0.20,3.781%,10971207425.00,Netherlands,,2996480,Finance,Life Insurance
AEL,American Equity Investment Life Holding Company Common Stock,$39.61,-0.30,-0.752%,3840156782.00,United States,2003,785670,Finance,Life Insurance
AEL^A,American Equity Investment Life Holding Company Depositary Shares each representing a 1/1000th interest in a share of 5.95% Fixed-Rate Reset Non-Cumulative Preferred Stock Series A,$25.39,-0.16,-0.626%,,United States,,7639,,
AEL^B,American Equity Investment Life Holding Company Depositary Shares each representing a 1/1000th interest in a share of 6.625% Fixed-Rate Reset Non-Cumulative Preferred Stock Series B,$26.085,-0.185,-0.704%,,United States,,8519,,
AEM,Agnico Eagle Mines Limited Common Stock,$63.28,2.04,3.331%,28829524921.00,Canada,,2587697,,
AENZ,Aenza S.A.A. American Depositary Shares,$1.71,0.07,4.268%,311123872.00,,2018,2506,Basic Industries,Military/Government/Technical
AEO,American Eagle Outfitters Inc. Common Stock,$16.05,-0.75,-4.464%,2709920841.00,United States,,7298433,Consumer Services,Clothing/Shoe/Accessory Stores
AER,AerCap Holdings N.V. Ordinary Shares,$50.50,0.22,0.438%,12366383844.00,Netherlands,2006,1670306,Technology,Diversified Commercial Services
AES,The AES Corporation Common Stock,$26.22,0.49,1.904%,17499100623.00,United States,,4588902,Public Utilities,Electric Utilities: Central
AESC,The AES Corporation Corporate Units,$101.14,2.21,2.234%,0.00,United States,,61983,Public Utilities,Electric Utilities: Central
AEVA,Aeva Technologies Inc. Common Stock,$4.11,-0.22,-5.081%,887735488.00,,2020,1374729,Capital Goods,Auto Parts:O.E.M.
AFB,AllianceBernstein National Municipal Income Fund Inc,$12.65,0.06,0.477%,363623440.00,United States,2002,95095,Finance,Trusts Except Educational Religious and Charitable
AFG,American Financial Group Inc. Common Stock,$148.22,2.60,1.785%,12588643421.00,United States,,331325,Finance,Property-Casualty Insurers
AFGB,American Financial Group Inc. 5.875% Subordinated Debentures due 2059,$26.102,-0.148,-0.564%,0.00,United States,2019,19794,Finance,Property-Casualty Insurers
AFGC,American Financial Group Inc. 5.125% Subordinated Debentures due 2059,$24.49,-0.05,-0.204%,24442489.00,United States,2019,6962,Finance,Real Estate
AFGD,American Financial Group Inc. 5.625% Subordinated Debentures due 2060,$25.48,0.11,0.434%,0.00,United States,2020,3454,,
AFGE,American Financial Group Inc. 4.500% Subordinated Debentures due 2060,$22.35,-0.41,-1.801%,0.00,United States,2020,3482,,
AFI,Armstrong Flooring Inc. Common Stock,$1.46,0.03,2.098%,31798180.00,,2016,252603,Capital Goods,Building Products
AFL,AFLAC Incorporated Common Stock,$64.84,0.45,0.699%,42105021639.00,United States,,2163997,Finance,Accident &Health Insurance
AFT,Apollo Senior Floating Rate Fund Inc. Common Stock,$14.71,0.09,0.616%,229087288.00,,2011,88235,Finance,Investment Managers
AFTR,AfterNext HealthTech Acquisition Corp. Class A Ordinary Shares,$9.68,0.00,0.00%,302500000.00,,2021,47223,,
AG,First Majestic Silver Corp. Ordinary Shares (Canada),$13.58,0.42,3.191%,3533267133.00,Canada,,3661577,,
AGAC,African Gold Acquisition Corporation Class A Ordinary Shares,$9.8024,-0.0076,-0.077%,507274200.00,,2021,239,Finance,Business Services
AGCB,Altimeter Growth Corp. 2 Class A Ordinary Shares,$9.81,-0.01,-0.102%,562603500.00,,2021,87498,Finance,Business Services
AGCO,AGCO Corporation Common Stock,$144.72,-1.31,-0.897%,10787647761.00,United States,,745635,Capital Goods,Industrial Machinery/Components
AGD,Aberdeen Global Dynamic Dividend Fund,$11.35,0.15,1.339%,142437744.00,United States,2006,23624,Finance,Trusts Except Educational Religious and Charitable
AGI,Alamos Gold Inc. Class A Common Shares,$8.67,0.25,2.969%,3398696841.00,Canada,2015,3376011,,
AGL,agilon health inc. Common Stock,$26.05,0.70,2.761%,10450681117.00,,2021,998001,Health Care,Managed Health Care
AGM,Federal Agricultural Mortgage Corporation Common Stock,$110.33,1.85,1.705%,1187978606.00,United States,,36495,Finance,Finance Companies
AGM^C,Federal Agricultural Mortgage Corporation Preferred Series C Fixed to Fltg,$26.00,0.00,0.00%,,United States,,1325,,
AGM^D,Federal Agricultural Mortgage Corporation 5.700% Non-Cumulative Preferred Stock Series D,$24.9899,-0.2801,-1.108%,,United States,,8513,,
AGM^E,Federal Agricultural Mortgage Corporation 5.750% Non-Cumulative Preferred Stock Series E,$25.13,-0.02,-0.08%,,United States,,8061,,
AGM^F,Federal Agricultural Mortgage Corporation 5.250% Non-Cumulative Preferred Stock Series F,$23.125,-0.275,-1.175%,,United States,,18412,,
AGM^G,Federal Agricultural Mortgage Corporation 4.875% Non-Cumulative Preferred Stock Series G,$22.01,-0.21,-0.945%,,United States,,23390,,
AGO,Assured Guaranty Ltd. Common Stock,$65.09,1.43,2.246%,4275856025.00,Bermuda,2004,437493,Finance,Property-Casualty Insurers
AGR,Avangrid Inc. Common Stock,$47.49,0.75,1.605%,18358565190.00,United States,2015,418565,Public Utilities,Electric Utilities: Central
AGRO,Adecoagro S.A. Common Shares,$12.34,0.26,2.152%,1370934166.00,Luxembourg,2011,2405805,,Farming/Seeds/Milling
AGS,PlayAGS Inc. Common Stock,$6.50,-0.17,-2.549%,240291415.00,United States,2018,177090,Consumer Services,Recreational Products/Toys
AGTI,Agiliti Inc. Common Stock,$21.37,0.27,1.28%,2801607000.00,,2021,373996,Health Care,Managed Health Care
AGX,Argan Inc. Common Stock,$40.43,-0.16,-0.394%,635347140.00,United States,,72609,Capital Goods,Oilfield Services/Equipment
AHH,Armada Hoffler Properties Inc. Common Stock,$14.86,0.26,1.781%,1000439291.00,United States,2013,586533,Consumer Services,Real Estate Investment Trusts
AHH^A,Armada Hoffler Properties Inc. 6.75% Series A Cumulative Redeemable Perpetual Preferred Stock,$25.60,-0.38,-1.463%,,United States,,15980,,
AHL^C,Aspen Insurance Holdings Limited 5.95% Fixed-to-Floating Rate Perpetual Non-Cumulative Preference Shares,$25.85,-0.08,-0.309%,,Bermuda,,10889,,
AHL^D,Aspen Insurance Holdings Limited 5.625% Perpetual Non-Cumulative Preference Shares,$25.20,-0.03,-0.119%,,Bermuda,,32671,,
AHL^E,Aspen Insurance Holdings Limited Depositary Shares each representing a 1/1000th interest in a share of 5.625% Perpetual Non-Cumulative Preference Shares,$24.80,0.04,0.162%,,Bermuda,,23971,,
AHT,Ashford Hospitality Trust Inc Common Stock,$9.83,-0.37,-3.627%,339070407.00,United States,2003,765323,Consumer Services,Real Estate Investment Trusts
AHT^D,Ashford Hospitality Trust Inc 8.45% Series D Cumulative Preferred Stock,$24.61,-0.02,-0.081%,,United States,,700,,
AHT^F,Ashford Hospitality Trust Inc 7.375% Series F Cumulative Preferred Stock,$22.50,-0.18,-0.794%,,United States,,911,,
AHT^G,Ashford Hospitality Trust Inc 7.375% Series G Cumulative Preferred Stock,$22.94,0.44,1.956%,,United States,,2216,,
AHT^H,Ashford Hospitality Trust Inc 7.50% Series H Cumulative Preferred Stock,$22.19,-0.01,-0.045%,,United States,,1125,,
AHT^I,Ashford Hospitality Trust Inc 7.50% Series I Cumulative Preferred Stock,$21.48,-0.43,-1.963%,,United States,,831,,
AI,C3.ai Inc. Class A Common Stock,$23.02,0.32,1.41%,2448678905.00,,2020,1375676,Technology,Computer Software: Prepackaged Software
AIC,Arlington Asset Investment Corp 6.750% Notes due 2025,$25.1799,0.0395,0.157%,0.00,United States,2015,3086,Consumer Services,Real Estate Investment Trusts
AIF,Apollo Tactical Income Fund Inc. Common Stock,$14.48,0.12,0.836%,209439096.00,,2013,100555,Finance,Finance Companies
AIG,American International Group Inc. New Common Stock,$63.79,1.02,1.625%,54956726572.00,United States,,3802821,Finance,Life Insurance
AIG^A,American International Group Inc. Depositary Shares Each Representing a 1/1000th Interest in a Share of Series A 5.85% Non-Cumulative Perpetual Preferred Stock,$25.63,-0.33,-1.271%,,United States,,15467,,
AIN,Albany International Corporation Common Stock,$85.81,1.49,1.767%,2733915524.00,United States,,201192,Basic Industries,Textiles
AIO,Virtus AllianzGI Artificial Intelligence & Technology Opportunities Fund Common Shares,$22.08,0.22,1.006%,758198099.00,,2019,122670,Finance,Finance/Investors Services
AIR,AAR Corp. Common Stock,$48.62,0.19,0.392%,1711262436.00,United States,,416951,Capital Goods,Aerospace
AIRC,Apartment Income REIT Corp. Common Stock,$54.73,1.27,2.376%,8599047562.00,,2020,624586,Consumer Services,Real Estate Investment Trusts
AIT,Applied Industrial Technologies Inc. Common Stock,$103.58,0.92,0.896%,3983326238.00,United States,,337209,Capital Goods,Industrial Machinery/Components
AIV,Apartment Investment and Management Company Common Stock,$7.39,0.07,0.956%,1127390843.00,United States,1994,553561,Consumer Services,Real Estate Investment Trusts
AIZ,Assurant Inc. Common Stock,$185.42,3.59,1.974%,10700292270.00,United States,2004,426511,Finance,Specialty Insurers
AIZN,Assurant Inc. 5.25% Subordinated Notes due 2061,$23.26,0.04,0.172%,0.00,United States,2020,11694,Finance,Accident &Health Insurance
AJG,Arthur J. Gallagher & Co. Common Stock,$176.40,1.80,1.031%,36975936589.00,United States,,799795,Finance,Specialty Insurers
AJRD,Aerojet Rocketdyne Holdings Inc. Common Stock,$40.20,0.85,2.16%,3237876719.00,United States,,1062293,Capital Goods,Military/Government/Technical
AJX,Great Ajax Corp. Common Stock,$11.54,-0.19,-1.62%,267142714.00,United States,2015,132953,Consumer Services,Real Estate Investment Trusts
AJXA,Great Ajax Corp. 7.25% Convertible Senior Notes due 2024,$24.9999,0.0099,0.04%,0.00,United States,2017,9581,Consumer Services,Real Estate Investment Trusts
AKA,a.k.a. Brands Holding Corp. Common Stock,$4.38,-0.04,-0.905%,563477522.00,,2021,108800,Consumer Non-Durables,Department/Specialty Retail Stores
AKO/A,Embotelladora Andina S.A.,$11.22,0.33,3.03%,,Chile,,1470,,
AKO/B,Embotelladora Andina S.A.,$13.77,0.165,1.213%,,Chile,,3305,,
AKR,Acadia Realty Trust Common Stock,$21.76,0.09,0.415%,2037143739.00,United States,,750485,Consumer Services,Real Estate Investment Trusts
AL,Air Lease Corporation Class A Common Stock,$44.37,-0.28,-0.627%,5069232523.00,United States,2011,1528097,Technology,Diversified Commercial Services
AL^A,Air Lease Corporation 6.150% Fixed-to-Floating Rate Non-Cumulative Perpetual Preferred Stock Series A,$25.02,-0.08,-0.319%,,United States,,10762,,
ALB,Albemarle Corporation Common Stock,$224.92,3.77,1.705%,26340919658.00,United States,,864501,Basic Industries,Industrial Specialties
ALC,Alcon Inc. Ordinary Shares,$79.74,0.41,0.517%,39079535865.00,Switzerland,2019,786651,Health Care,Ophthalmic Goods
ALCC,AltC Acquisition Corp. Class A Common Stock,$9.76,0.00,0.00%,624152000.00,,2021,98,,
ALE,Allete Inc.,$63.82,-3.16,-4.718%,3401921909.00,United States,,3157581,Public Utilities,Power Generation
ALEX,Alexander & Baldwin Inc. Common Stock REIT Holding Company,$23.60,0.41,1.768%,1715256590.00,United States,,410759,Consumer Services,Real Estate Investment Trusts
ALG,Alamo Group Inc. Common Stock,$142.63,-1.16,-0.807%,1702510412.00,United States,,60623,Capital Goods,Industrial Machinery/Components
ALIN^A,Altera Infrastructure L.P. 7.25% Series A ,$4.44,-0.08,-1.77%,,Bermuda,,2195,,
ALIN^B,Altera Infrastructure L.P. 8.50% Series B ,$4.79,0.09,1.915%,,Bermuda,,1206,,
ALIN^E,Altera Infrastructure L.P. 8.875% Series E ,$4.805,0.135,2.891%,,Bermuda,,963,,
ALIT,Alight Inc. Class A Common Stock,$9.39,-0.56,-5.628%,4368337009.00,,2021,2472833,Technology,EDP Services
ALK,Alaska Air Group Inc. Common Stock,$57.95,-0.06,-0.103%,7306718876.00,United States,,1601426,Transportation,Air Freight/Delivery Services
ALL,Allstate Corporation (The) Common Stock,$139.54,1.03,0.744%,38840409212.00,United States,,1276336,Finance,Property-Casualty Insurers
ALL^B,Allstate Corporation (The) 5.100% Fixed-to-Floating Rate Subordinated Debentures due 2053,$25.36,-0.06,-0.236%,,United States,,15665,,
ALL^G,Allstate Corporation (The) Depositary Shares each representing a 1/1000th interest in a share of Fixed Rate Noncumulative Perpetual Preferred Stock Series G,$25.34,-0.08,-0.315%,,United States,,35350,,
ALL^H,Allstate Corporation (The) Depositary Shares each representing a 1/1000th interest in a share of Fixed Rate Noncumulative Perpetual Preferred Stock Series H,$24.73,-0.11,-0.443%,,United States,,97155,,
ALL^I,Allstate Corporation (The) Depositary Shares each representing a 1/1000th interest in a share of Fixed Rate Noncumulative Perpetual Preferred Stock Series I,$24.57,-0.12,-0.486%,,United States,,17816,,
ALLE,Allegion plc Ordinary Shares,$111.52,1.74,1.585%,9839458892.00,United States,2013,602745,Consumer Services,Diversified Commercial Services
ALLG,Allego N.V. Ordinary Share,$12.32,-2.80,-18.519%,3269041776.00,,2022,551288,,
ALLY,Ally Financial Inc. Common Stock,$43.98,0.50,1.15%,14577311164.00,United States,2014,3221919,Finance,Diversified Financial Services
ALP^Q,Alabama Power Company 5.00% Class A Preferred Stock Cumulative Par Value $1 Per Share (Stated Capital $25 Per Share),$25.32,-0.01,-0.039%,,United States,,8688,,
ALSN,Allison Transmission Holdings Inc. Common Stock,$38.67,-0.59,-1.503%,3753373889.00,United States,2012,640353,Capital Goods,Auto Parts:O.E.M.
ALTG,Alta Equipment Group Inc. Class A Common Stock,$13.79,1.43,11.57%,446290955.00,,2019,333275,Technology,Engineering & Construction
ALTG^A,Alta Equipment Group Inc. Depositary Shares (each representing 1/1000th in a share of 10% Series A Cumulative Perpetual Preferred Stock),$29.00,0.00,0.00%,,,,10,,
ALV,Autoliv Inc. Common Stock,$76.99,0.55,0.72%,6739271300.00,Sweden,,1130876,Capital Goods,Auto Parts:O.E.M.
ALX,Alexander's Inc. Common Stock,$260.99,4.76,1.858%,1332951617.00,United States,,12065,Consumer Services,Real Estate Investment Trusts
AM,Antero Midstream Corporation Common Stock,$10.90,0.03,0.276%,5206741975.00,United States,2017,3624497,Public Utilities,Natural Gas Distribution
AMAM,Ambrx Biopharma Inc. American Depositary Shares (each representing seven Ordinary Shares),$4.08,-0.04,-0.971%,142617236.00,,2021,14080,,
AMBC,Ambac Financial Group Inc. Common Stock,$10.17,-0.23,-2.212%,471247351.00,United States,,1196193,Finance,Property-Casualty Insurers
AMBP,Ardagh Metal Packaging S.A. Ordinary Shares,$8.30,0.17,2.091%,5007367482.00,,,775601,,
AMC,AMC Entertainment Holdings Inc. Class A Common Stock,$23.30,-1.34,-5.438%,12040949419.00,,2013,65587846,Consumer Services,Movies/Entertainment
AMCR,Amcor plc Ordinary Shares,$11.54,0.21,1.853%,17468412096.00,,2019,7980931,Consumer Durables,Miscellaneous manufacturing industries
AME,AMETEK Inc.,$134.38,1.20,0.901%,31064742854.00,United States,,795138,Consumer Durables,Metal Fabrications
AMG,Affiliated Managers Group Inc. Common Stock,$144.47,3.52,2.497%,5746806107.00,United States,,270988,Finance,Investment Managers
AMH,American Homes 4 Rent Common Shares of Beneficial Interest,$40.85,0.82,2.048%,14226391180.00,,2013,2058738,Consumer Services,Real Estate Investment Trusts
AMH^F,American Homes 4 Rent 5.875% Series F Cumulative Redeemable Perpetual Preferred Shares,$25.10,0.04,0.16%,,,,16463,,
AMH^G,American Homes 4 Rent Series G cumulative redeemable perpetual preferred shares of beneficial interest,$25.26,0.18,0.718%,,,,9434,,
AMH^H,American Homes 4 Rent Series H cumulative redeemable perpetual Preferred Shares of Beneficial Interest,$26.24,0.43,1.666%,,,,5570,,
AMK,AssetMark Financial Holdings Inc. Common Stock,$22.78,0.53,2.382%,1675776553.00,United States,2019,78142,Finance,Finance/Investors Services
AMN,AMN Healthcare Services Inc AMN Healthcare Services Inc,$105.28,0.95,0.911%,4839779504.00,United States,,498613,Health Care,Assisted Living Services
AMOV,America Movil S.A.B. de C.V. Class A American Depositary Shares,$21.59,0.59,2.81%,69351613900.00,Mexico,,8459,Public Utilities,Telecommunications Equipment
AMP,Ameriprise Financial Inc. Common Stock,$297.41,-2.95,-0.982%,32886764160.00,United States,,609387,Finance,Investment Managers
AMPI,Advanced Merger Partners Inc. Class A Common Stock,$9.78,0.01,0.102%,351468750.00,,2021,9311,,
AMPS,Altus Power Inc. Class A Common Stock,$7.60,0.17,2.288%,1167731108.00,,2021,325030,,
AMPY,Amplify Energy Corp. Common Stock,$5.78,0.28,5.091%,220011157.00,United States,2016,1125501,Energy,Oil & Gas Production
AMR,Alpha Metallurgical Resources Inc. Common Stock,$134.84,2.88,2.182%,2498988641.00,United States,2018,317532,Energy,Coal Mining
AMRC,Ameresco Inc. Class A Common Stock,$80.02,0.52,0.654%,4138979206.00,United States,2010,266103,Basic Industries,Water Sewer Pipeline Comm & Power Line Construction
AMRX,Amneal Pharmaceuticals Inc. Class A Common Stock,$4.30,0.13,3.118%,647748435.00,,2018,462614,Health Care,Biotechnology: Pharmaceutical Preparations
AMT,American Tower Corporation (REIT) Common Stock,$256.95,5.73,2.281%,117139600902.00,United States,,1636238,Finance,Trusts Except Educational Religious and Charitable
AMTD,AMTD IDEA Group American Depositary Shares each representing one Class A Ordinary Share,$2.33,-0.04,-1.688%,599494370.00,,2019,94455,Finance,Finance: Consumer Services
AMWL,American Well Corporation Class A Common Stock,$4.35,0.14,3.325%,1145419619.00,United States,2020,2117280,Technology,Retail: Computer Software & Peripheral Equipment
AMX,America Movil S.A.B. de C.V. American Depository Receipt Series L,$21.79,0.64,3.026%,69994055900.00,Mexico,,2891334,Public Utilities,Telecommunications Equipment
AN,AutoNation Inc. Common Stock,$98.84,-0.74,-0.743%,6065964892.00,United States,,1429611,Consumer Services,Other Specialty Stores
ANAC,Arctos NorthStar Acquisition Corp. Class A Ordinary Shares,$9.79,0.00,0.00%,387010938.00,,2021,18221,Finance,Business Services
ANET,Arista Networks Inc. Common Stock,$139.48,0.50,0.36%,42927282299.00,,2014,1249316,Technology,Computer peripheral equipment
ANF,Abercrombie & Fitch Company Common Stock,$31.42,-0.57,-1.782%,1590660342.00,United States,,1293065,Consumer Services,Clothing/Shoe/Accessory Stores
ANTM,Anthem Inc. Common Stock,$499.33,8.11,1.651%,120490510573.00,United States,,1226106,Health Care,Medical Specialities
ANVS,Annovis Bio Inc. Common Stock,$13.83,0.48,3.596%,112907055.00,United States,2020,29862,Consumer Durables,Specialty Chemicals
